{
  "bundleId": "english-question-lab-generator-v0",
  "bundleVersion": "0.1.0-rc.1",
  "bundleStatus": "release_candidate",
  "targetEnvironment": "custom_gpt_manual_copy_paste",
  "createdFrom": {
    "generatorCoreReadiness": "READY_TO_BUILD_GENERATOR_V0",
    "runtimeProfileVerdict": "READY_TO_BUILD_GENERATOR_V0_RELEASE_BUNDLE",
    "runtimeFingerprint": "64a5b6d8dc9d5d61cef3e8c62d24fa4fbe819d2f5698a24ec56cc7ef2f8f688c",
    "detailedProfileFingerprint": "5758a177ca3ca064b244897999e7dc2d6211ea2edf53c10a987ce3dfe71d9fa4"
  },
  "approvedPrecedence": [
    "generation_contract_and_json_schema",
    "request_identity_template_variant_and_blueprint_integrity",
    "copyright_and_source_exam_non_reproduction",
    "approved_request_specific_prompt",
    "generator_core_general_principles",
    "corpus_runtime_profile",
    "non_conflicting_user_follow_up"
  ],
  "components": [
    {
      "role": "generator_core",
      "canonicalProject": "english-question-lab",
      "canonicalSource": "docs/english-gpt/GENERATOR_CORE_INSTRUCTIONS_V0.md",
      "bundledPath": "instructions/GENERATOR_CORE_INSTRUCTIONS_V0.md",
      "canonicalSha256": "00bdb21060f632969a3fd9bfcfbf0965b0af23688663bf51a3b08c20bbc163eb",
      "bundledSha256": "00bdb21060f632969a3fd9bfcfbf0965b0af23688663bf51a3b08c20bbc163eb",
      "canonicalByteSize": 18998,
      "bundledByteSize": 18998,
      "identity": "English Question Generator v0 — Core Instructions",
      "requiredAtRuntime": true,
      "precedence": 5,
      "provenance": "byte_identical_snapshot"
    },
    {
      "role": "generation_contract",
      "canonicalProject": "english-question-lab",
      "canonicalSource": "docs/english-gpt/GENERATION_CONTRACT_V0.md",
      "bundledPath": "knowledge/GENERATION_CONTRACT_V0.md",
      "canonicalSha256": "3a812106b9a5183debbc795f66f856dccb44f9dc8f84516d171fae1cf41de03c",
      "bundledSha256": "3a812106b9a5183debbc795f66f856dccb44f9dc8f84516d171fae1cf41de03c",
      "canonicalByteSize": 4101,
      "bundledByteSize": 4101,
      "identity": "English Question Generation Contract v0",
      "requiredAtRuntime": true,
      "precedence": 1,
      "provenance": "byte_identical_snapshot"
    },
    {
      "role": "output_json_schema",
      "canonicalProject": "english-question-lab",
      "canonicalSource": "docs/english-gpt/csat-output-schema.json",
      "bundledPath": "knowledge/csat-output-schema.json",
      "canonicalSha256": "2cf9022d6c8498386e21ca7a3737d1b35c69ab459a8954f6b079c918ace5b61c",
      "bundledSha256": "2cf9022d6c8498386e21ca7a3737d1b35c69ab459a8954f6b079c918ace5b61c",
      "canonicalByteSize": 8084,
      "bundledByteSize": 8084,
      "identity": "English Question Lab CSAT Batch Result",
      "requiredAtRuntime": true,
      "precedence": 1,
      "provenance": "byte_identical_snapshot"
    },
    {
      "role": "style_manual",
      "canonicalProject": "english-question-lab",
      "canonicalSource": "docs/english-gpt/CSAT_STYLE_MANUAL.md",
      "bundledPath": "knowledge/CSAT_STYLE_MANUAL.md",
      "canonicalSha256": "743c0a7e83732f98a52214916d17ee5fef4f2cc12d2048e64ccabdf61546053d",
      "bundledSha256": "743c0a7e83732f98a52214916d17ee5fef4f2cc12d2048e64ccabdf61546053d",
      "canonicalByteSize": 10696,
      "bundledByteSize": 10696,
      "identity": "평가원형 수능 영어 읽기 제작 매뉴얼",
      "requiredAtRuntime": false,
      "precedence": "supplementary_non_authoritative",
      "provenance": "byte_identical_snapshot"
    },
    {
      "role": "runtime_profile_markdown",
      "canonicalProject": "corpus-engine",
      "canonicalSource": "profiles/GENERATION_RUNTIME_PROFILE_V0.4.md",
      "bundledPath": "knowledge/GENERATION_RUNTIME_PROFILE_V0.4.md",
      "canonicalSha256": "42fc90a388e706a1467de02ef9d26d3fdc4a0500cafdf1faae67473f82702d38",
      "bundledSha256": "42fc90a388e706a1467de02ef9d26d3fdc4a0500cafdf1faae67473f82702d38",
      "canonicalByteSize": 10207,
      "bundledByteSize": 10207,
      "identity": "csat-generator-runtime-evidence-v0.4",
      "requiredAtRuntime": true,
      "precedence": 6,
      "provenance": "byte_identical_snapshot"
    },
    {
      "role": "runtime_profile_json",
      "canonicalProject": "corpus-engine",
      "canonicalSource": "profiles/generation-runtime-profile-v0.4.json",
      "bundledPath": "knowledge/generation-runtime-profile-v0.4.json",
      "canonicalSha256": "5af3526617675ee77ea5fb6693037aa62e28ca892dc912d016604652b1343720",
      "bundledSha256": "5af3526617675ee77ea5fb6693037aa62e28ca892dc912d016604652b1343720",
      "canonicalByteSize": 13075,
      "bundledByteSize": 13075,
      "identity": "csat-generator-runtime-evidence-v0.4",
      "requiredAtRuntime": true,
      "precedence": 6,
      "provenance": "byte_identical_snapshot"
    },
    {
      "role": "runtime_profile_schema",
      "canonicalProject": "corpus-engine",
      "canonicalSource": "schemas/generation-runtime-profile-v0.4-schema.json",
      "bundledPath": "knowledge/generation-runtime-profile-v0.4-schema.json",
      "canonicalSha256": "8436e891b04ac003bfb3e8b3f52ebe9b89c96e1334bdae290bbd1947f22a99d6",
      "bundledSha256": "8436e891b04ac003bfb3e8b3f52ebe9b89c96e1334bdae290bbd1947f22a99d6",
      "canonicalByteSize": 1396,
      "bundledByteSize": 1396,
      "identity": "generation-runtime-profile-v0.4.0",
      "requiredAtRuntime": true,
      "precedence": 6,
      "provenance": "byte_identical_snapshot"
    },
    {
      "role": "custom_gpt_binding_instructions",
      "canonicalProject": null,
      "canonicalSource": null,
      "bundledPath": "instructions/GENERATOR_V0_CUSTOM_GPT_INSTRUCTIONS.md",
      "canonicalSha256": null,
      "bundledSha256": "c208e650540122a5653b8bf152a677ece777b6757f96515644451d25eb5a384d",
      "canonicalByteSize": null,
      "bundledByteSize": 7895,
      "identity": "Generator v0 Custom GPT binding instructions",
      "requiredAtRuntime": true,
      "precedence": "binding_with_approved_priority",
      "provenance": "deterministic_bundle_generation"
    },
    {
      "role": "custom_gpt_setup",
      "canonicalProject": null,
      "canonicalSource": null,
      "bundledPath": "custom-gpt-setup.md",
      "canonicalSha256": null,
      "bundledSha256": "6d5e16ca7205d942ccadb177ee6e2eb87d6193d8f1730acc717883c88128dff2",
      "canonicalByteSize": null,
      "bundledByteSize": 2945,
      "identity": "Custom GPT setup guide",
      "requiredAtRuntime": false,
      "precedence": "setup_only",
      "provenance": "deterministic_bundle_generation"
    }
  ],
  "validationCommands": [
    "node scripts/validate-generator-v0-custom-gpt-bundle.mjs",
    "node --test docs/english-gpt/releases/generator-v0-custom-gpt/tests/generator-v0-custom-gpt-bundle.node-test.mjs",
    "pnpm verify"
  ],
  "unsupportedFeatures": [
    "automatic_api_generation",
    "automatic_app_import",
    "automatic_corpus_synchronization",
    "difficulty_calibration",
    "human_verified_semantic_distributions",
    "source_exam_reproduction"
  ],
  "knownLimitations": [
    "manual Request and JSON transfer",
    "Custom GPT editor capacity must be confirmed in the actual UI",
    "Runtime Profile 0.4 is candidate because semantic annotations are not human verified",
    "Style Manual is supplementary and non-authoritative"
  ],
  "deterministicBuild": {
    "timestampIncluded": false,
    "canonicalEncoding": "UTF-8; source snapshots copied byte-for-byte",
    "manifestFingerprintExcludes": [
      "manifestFingerprint"
    ]
  },
  "manifestFingerprint": "e741041c9b122e6e89d472e35bade83740167e2c8e1569076010e505f3ee2ecf"
}
